{
  "$schema": "./arsenal.schema.json",
  "version": "1.0.0",
  "updated_at": "2026-04-28",
  "defaults": {
    "rate_limit": {
      "rpm": 60,
      "rph": 1000,
      "concurrent": 4
    },
    "retry": {
      "max_attempts": 6,
      "base_ms": 1000,
      "max_ms": 60000
    },
    "timeout_ms": 30000,
    "user_agent": "TransparenciaBR/2.0 (+https://transparenciabr.org/bot)"
  },
  "apis": [
    {
      "rate_limit": {
        "rpm": 60,
        "rph": 1000,
        "concurrent": 4
      },
      "incremental": null,
      "method": "GET",
      "id": "senado_agenda_dia",
      "dominio": "legislativo",
      "fonte": "Senado Federal",
      "base_url": "https://legis.senado.leg.br/dadosabertos",
      "endpoint": "/agendareuniao/{AAAAMMDD}.json",
      "auth": {
        "type": "none"
      },
      "pagination": {
        "type": "date_window"
      },
      "format": "json",
      "gcs_prefix": "legislativo/senado/agenda_dia",
      "bigquery": {
        "external_table_name": "senado_agenda_dia",
        "schema_inferable": true
      },
      "prioridade": "imediata"
    },
    {
      "rate_limit": {
        "rpm": 60,
        "rph": 1000,
        "concurrent": 4
      },
      "incremental": null,
      "method": "GET",
      "id": "senado_agenda_30d",
      "dominio": "legislativo",
      "fonte": "Senado Federal",
      "base_url": "https://legis.senado.leg.br/dadosabertos",
      "endpoint": "/agendareuniao/atual",
      "auth": {
        "type": "none"
      },
      "pagination": {
        "type": "none"
      },
      "format": "json",
      "gcs_prefix": "legislativo/senado/agenda_30d",
      "bigquery": {
        "external_table_name": "senado_agenda_30d",
        "schema_inferable": true
      },
      "prioridade": "imediata"
    },
    {
      "rate_limit": {
        "rpm": 60,
        "rph": 1000,
        "concurrent": 4
      },
      "incremental": null,
      "method": "GET",
      "id": "senado_lista_atual",
      "dominio": "legislativo",
      "fonte": "Senado Federal",
      "base_url": "https://legis.senado.leg.br/dadosabertos",
      "endpoint": "/senador/lista/atual",
      "auth": {
        "type": "none"
      },
      "pagination": {
        "type": "none"
      },
      "format": "json",
      "gcs_prefix": "legislativo/senado/senadores_lista",
      "bigquery": {
        "external_table_name": "senado_lista_atual",
        "schema_inferable": true
      },
      "prioridade": "imediata"
    },
    {
      "rate_limit": {
        "rpm": 60,
        "rph": 1000,
        "concurrent": 4
      },
      "incremental": null,
      "method": "GET",
      "id": "senado_perfil",
      "dominio": "legislativo",
      "fonte": "Senado Federal",
      "base_url": "https://legis.senado.leg.br/dadosabertos",
      "endpoint": "/senador/{codigo}",
      "auth": {
        "type": "none"
      },
      "pagination": {
        "type": "iter_ids"
      },
      "format": "json",
      "gcs_prefix": "legislativo/senado/senador_perfil",
      "bigquery": {
        "external_table_name": "senado_perfil",
        "schema_inferable": true
      },
      "prioridade": "imediata"
    },
    {
      "rate_limit": {
        "rpm": 60,
        "rph": 1000,
        "concurrent": 4
      },
      "incremental": null,
      "method": "GET",
      "id": "senado_votacoes_senador",
      "dominio": "legislativo",
      "fonte": "Senado Federal",
      "base_url": "https://legis.senado.leg.br/dadosabertos",
      "endpoint": "/senador/{codigo}/votacoes",
      "auth": {
        "type": "none"
      },
      "pagination": {
        "type": "iter_ids"
      },
      "format": "json",
      "gcs_prefix": "legislativo/senado/senador_votacoes",
      "bigquery": {
        "external_table_name": "senado_votacoes_senador",
        "schema_inferable": true
      },
      "prioridade": "imediata"
    },
    {
      "rate_limit": {
        "rpm": 60,
        "rph": 1000,
        "concurrent": 4
      },
      "incremental": null,
      "method": "GET",
      "id": "senado_autorias_senador",
      "dominio": "legislativo",
      "fonte": "Senado Federal",
      "base_url": "https://legis.senado.leg.br/dadosabertos",
      "endpoint": "/senador/{codigo}/autorias",
      "auth": {
        "type": "none"
      },
      "pagination": {
        "type": "iter_ids"
      },
      "format": "json",
      "gcs_prefix": "legislativo/senado/senador_autorias",
      "bigquery": {
        "external_table_name": "senado_autorias_senador",
        "schema_inferable": true
      },
      "prioridade": "imediata"
    },
    {
      "rate_limit": {
        "rpm": 60,
        "rph": 1000,
        "concurrent": 4
      },
      "incremental": null,
      "method": "GET",
      "id": "senado_despesas_senador",
      "dominio": "legislativo",
      "fonte": "Senado Federal",
      "base_url": "https://legis.senado.leg.br/dadosabertos",
      "endpoint": "/senador/{codigo}/despesas",
      "auth": {
        "type": "none"
      },
      "pagination": {
        "type": "iter_ids"
      },
      "format": "json",
      "gcs_prefix": "legislativo/senado/senador_despesas",
      "bigquery": {
        "external_table_name": "senado_despesas_senador",
        "schema_inferable": true
      },
      "prioridade": "imediata"
    },
    {
      "rate_limit": {
        "rpm": 60,
        "rph": 1000,
        "concurrent": 4
      },
      "incremental": null,
      "method": "GET",
      "id": "senado_votacoes_ano",
      "dominio": "legislativo",
      "fonte": "Senado Federal",
      "base_url": "https://legis.senado.leg.br/dadosabertos",
      "endpoint": "/plenario/votacoes/{ano}",
      "auth": {
        "type": "none"
      },
      "pagination": {
        "type": "year_loop"
      },
      "format": "json",
      "gcs_prefix": "legislativo/senado/plenario_votacoes_ano",
      "bigquery": {
        "external_table_name": "senado_votacoes_ano",
        "schema_inferable": true
      },
      "prioridade": "imediata"
    },
    {
      "rate_limit": {
        "rpm": 60,
        "rph": 1000,
        "concurrent": 4
      },
      "incremental": null,
      "method": "GET",
      "id": "senado_votacao_detalhe",
      "dominio": "legislativo",
      "fonte": "Senado Federal",
      "base_url": "https://legis.senado.leg.br/dadosabertos",
      "endpoint": "/plenario/votacao/{codigo}",
      "auth": {
        "type": "none"
      },
      "pagination": {
        "type": "iter_ids"
      },
      "format": "json",
      "gcs_prefix": "legislativo/senado/plenario_votacao_detalhe",
      "bigquery": {
        "external_table_name": "senado_votacao_detalhe",
        "schema_inferable": true
      },
      "prioridade": "imediata"
    },
    {
      "rate_limit": {
        "rpm": 60,
        "rph": 1000,
        "concurrent": 4
      },
      "incremental": null,
      "method": "GET",
      "id": "senado_agenda_plenario",
      "dominio": "legislativo",
      "fonte": "Senado Federal",
      "base_url": "https://legis.senado.leg.br/dadosabertos",
      "endpoint": "/agenda/{data}",
      "auth": {
        "type": "none"
      },
      "pagination": {
        "type": "date_window"
      },
      "format": "json",
      "gcs_prefix": "legislativo/senado/agenda_plenario",
      "bigquery": {
        "external_table_name": "senado_agenda_plenario",
        "schema_inferable": true
      },
      "prioridade": "imediata"
    },
    {
      "rate_limit": {
        "rpm": 60,
        "rph": 1000,
        "concurrent": 4
      },
      "incremental": null,
      "method": "GET",
      "id": "tcu_acordaos",
      "dominio": "controle_externo",
      "fonte": "TCU",
      "base_url": "https://dados-abertos.apps.tcu.gov.br",
      "endpoint": "/api/acordao/recupera-acordaos",
      "auth": {
        "type": "none"
      },
      "pagination": {
        "type": "page"
      },
      "format": "json",
      "gcs_prefix": "controle_externo/tcu/acordaos",
      "bigquery": {
        "external_table_name": "tcu_acordaos",
        "schema_inferable": true
      },
      "prioridade": "imediata"
    },
    {
      "rate_limit": {
        "rpm": 60,
        "rph": 1000,
        "concurrent": 4
      },
      "incremental": null,
      "method": "GET",
      "id": "tcu_pj",
      "dominio": "controle_externo",
      "fonte": "TCU",
      "base_url": "https://contas.tcu.gov.br/ords/api",
      "endpoint": "/publica/pj/",
      "auth": {
        "type": "none"
      },
      "pagination": {
        "type": "offset"
      },
      "format": "json",
      "gcs_prefix": "controle_externo/tcu/processos_judiciais",
      "bigquery": {
        "external_table_name": "tcu_pj",
        "schema_inferable": true
      },
      "prioridade": "imediata"
    },
    {
      "rate_limit": {
        "rpm": 60,
        "rph": 1000,
        "concurrent": 4
      },
      "incremental": null,
      "method": "GET",
      "id": "tcu_sancoes",
      "dominio": "controle_externo",
      "fonte": "TCU",
      "base_url": "https://contas.tcu.gov.br/ords/api",
      "endpoint": "/publica/sancoes/",
      "auth": {
        "type": "none"
      },
      "pagination": {
        "type": "offset"
      },
      "format": "json",
      "gcs_prefix": "controle_externo/tcu/sancoes",
      "bigquery": {
        "external_table_name": "tcu_sancoes",
        "schema_inferable": true
      },
      "prioridade": "imediata"
    },
    {
      "rate_limit": {
        "rpm": 60,
        "rph": 1000,
        "concurrent": 4
      },
      "incremental": null,
      "method": "GET",
      "id": "tcu_cadirreg",
      "dominio": "controle_externo",
      "fonte": "TCU",
      "base_url": "https://contas.tcu.gov.br/ords/api",
      "endpoint": "/publica/cadirreg/",
      "auth": {
        "type": "none"
      },
      "pagination": {
        "type": "offset"
      },
      "format": "json",
      "gcs_prefix": "controle_externo/tcu/cadirreg",
      "bigquery": {
        "external_table_name": "tcu_cadirreg",